century;identifier;author;title;rights
20;https://gallica.bnf.fr/ark:/12148/bpt6k33208560;Proust, Marcel (1871-1922) (nouvelle fenêtre);Promenades en Normandie avec un guide nommé Marcel Proust / [textes choisis et présentés par] Bernard Coulon;"[""conditions spécifiques d'utilisation - Projet de numérisation des indisponibles"", 'restricted use']"
20;https://gallica.bnf.fr/ark:/12148/bpt6k48122432;Proust, Marcel (1871-1922) (nouvelle fenêtre);Proust connu et inconnu / Gautier-Vignal;"[""conditions spécifiques d'utilisation - Projet de numérisation des indisponibles"", 'restricted use']"
20;https://gallica.bnf.fr/ark:/12148/bpt6k3399373h;Ramuz, Charles-Ferdinand (1878-1947) (nouvelle fenêtre);"C. F. Ramuz et la sainteté de la terre / Bernard Voyenne ; avec une post-face de Daniel-Rops";"[""conditions spécifiques d'utilisation - Projet de numérisation des indisponibles"", 'restricted use']"
20;https://gallica.bnf.fr/ark:/12148/bpt6k3324783s;Ramuz, Charles-Ferdinand (1878-1947) (nouvelle fenêtre);C. F. Ramuz qui êtes-vous ? / Marianne Ghirelli;"[""conditions spécifiques d'utilisation - Projet de numérisation des indisponibles"", 'restricted use']"
20;https://gallica.bnf.fr/ark:/12148/bpt6k33249629;Toulet, Paul-Jean (1867-1920) (nouvelle fenêtre);Paul-Jean Toulet / Pierre-Olivier Walzer;"[""conditions spécifiques d'utilisation - Projet de numérisation des indisponibles"", 'restricted use']"
20;https://gallica.bnf.fr/ark:/12148/bpt6k4813430f;Valéry, Paul (1871-1945) (nouvelle fenêtre);Les plus beaux poèmes français / présentés par René Lalou;"[""conditions spécifiques d'utilisation - Projet de numérisation des indisponibles"", 'restricted use']"
20;https://gallica.bnf.fr/ark:/12148/bpt6k33576495;Valéry, Paul (1871-1945) (nouvelle fenêtre);Hommage à André Gide;"[""conditions spécifiques d'utilisation - Projet de numérisation des indisponibles"", 'restricted use']"
20;https://gallica.bnf.fr/ark:/12148/bpt6k33718981;Valéry, Paul (1871-1945) (nouvelle fenêtre);"Moments d'un captif ; suivi de Requiem / André Bellivier ; précédé d'une lettre de Paul-Valéry [à A. Bellivier, 14 octobre 1940] ; orné de 8 tableaux de Stanislas Wojcieszynski";"[""conditions spécifiques d'utilisation - Projet de numérisation des indisponibles"", 'restricted use']"
