identifier,datestamp,setSpec,@xmlns:dc,@xmlns:oai_dc,@xmlns:xsi,@xsi:schemaLocation,dc:identifier,dc:title,dc:creator,dc:publisher,dc:date,dc:format,dc:language,dc:relation,dc:type,dc:source,dc:rights,dc:description,provenance,sdewey,dewey,source,typedoc,nqamoyen,mode_indexation,title,date,first_indexation_date,streamable
oai:bnf.fr:gallica/ark:/12148/bpt6k708598,2019-06-28,"['gallica:theme:8:84', 'gallica:typedoc:monographies']",http://purl.org/dc/elements/1.1/,http://www.openarchives.org/OAI/2.0/oai_dc/,http://www.w3.org/2001/XMLSchema-instance,http://www.openarchives.org/OAI/2.0/oai_dc/ http://www.openarchives.org/OAI/2.0/oai_dc.xsd,https://gallica.bnf.fr/ark:/12148/bpt6k708598,Artaud le Mômo / Antonin Artaud,"Artaud, Antonin (1896-1948). Auteur du texte",(Paris),1947,"['1 vol. (69 p.) : pl. ; in-16', 'Nombre total de vues :  86']","['fre', 'français']","[""Notice d'ensemble : http://catalogue.bnf.fr/ark:/12148/cb372983009"", 'Notice du catalogue : http://catalogue.bnf.fr/ark:/12148/cb372983009']","[{'@xml:lang': 'eng', '#text': 'text'}, {'@xml:lang': 'fre', '#text': 'monographie imprimée'}, {'@xml:lang': 'eng', '#text': 'monographie imprimée'}]","Bibliothèque nationale de France, département Fonds du service reproduction, Rés. p-Ye-1258","[{'@xml:lang': 'fre', '#text': 'domaine public'}, {'@xml:lang': 'eng', '#text': 'public domain'}]",Contient une table des matières,bnf.fr,84,8,"Bibliothèque nationale de France, département Fonds du service reproduction, Rés. p-Ye-1258",monographie,0.0,,Artaud le Mômo / Antonin Artaud,1947,30/12/2018,false
oai:bnf.fr:gallica/ark:/12148/bpt6k94370654,2022-07-29,"['gallica:corpus:BNUS1418Europeana', 'gallica:corpus:BNUStr000', 'gallica:corpus:BNUStras1', 'gallica:corpus:FrancComt1', 'gallica:typedoc:monographies']",http://purl.org/dc/elements/1.1/,http://www.openarchives.org/OAI/2.0/oai_dc/,http://www.w3.org/2001/XMLSchema-instance,http://www.openarchives.org/OAI/2.0/oai_dc/ http://www.openarchives.org/OAI/2.0/oai_dc.xsd,https://gallica.bnf.fr/ark:/12148/bpt6k94370654,"Thann, une ville martyre en Alsace / par Charles Krumholtz,... ; avant-propos de Mme la comtesse de Noailles","Krumholtz, Charles (18..-1936). Auteur du texte",impr. de Millot frères (Besançon),1915,"['1 vol. (VI-26 p.) : fig. ; 25 cm', 'Nombre total de vues :  46']",fre,Notice du catalogue : http://catalogue.bnf.fr/ark:/12148/cb30698005x,"[{'@xml:lang': 'eng', '#text': 'text'}, {'@xml:lang': 'fre', '#text': 'monographie imprimée'}, {'@xml:lang': 'eng', '#text': 'printed monograph'}]","Bibliothèque nationale et universitaire de Strasbourg, M120000","[{'@xml:lang': 'fre', '#text': 'domaine public'}, {'@xml:lang': 'eng', '#text': 'public domain'}]","['Appartient à l’ensemble documentaire : BNUStras1', 'Appartient à l’ensemble documentaire : BNUStr017', 'Appartient à l’ensemble documentaire : FrancComt1', 'Appartient à l’ensemble documentaire : BNUStr000']",bnf.fr,,,"Bibliothèque nationale et universitaire de Strasbourg, M120000",monographie,0.0,,"Thann, une ville martyre en Alsace / par Charles Krumholtz,... ; avant-propos de Mme la comtesse de Noailles",1915,09/12/2013,false
oai:bnf.fr:gallica/ark:/12148/bpt6k1422694f,2020-09-25,gallica:typedoc:monographies,http://purl.org/dc/elements/1.1/,http://www.openarchives.org/OAI/2.0/oai_dc/,http://www.w3.org/2001/XMLSchema-instance,http://www.openarchives.org/OAI/2.0/oai_dc/ http://www.openarchives.org/OAI/2.0/oai_dc.xsd,https://gallica.bnf.fr/ark:/12148/bpt6k1422694f,Colas Breugnon (50e éd.) / Romain Rolland,"Rolland, Romain (1866-1944). Auteur du texte",(Paris),1919,"['III-323 p.', 'Nombre total de vues :  346']","['fre', 'français']","['Notice d’oeuvre : http://catalogue.bnf.fr/ark:/12148/cb16265113d', 'Notice du catalogue : http://catalogue.bnf.fr/ark:/12148/cb35090871n']","[{'@xml:lang': 'eng', '#text': 'text'}, {'@xml:lang': 'fre', '#text': 'monographie imprimée'}, {'@xml:lang': 'eng', '#text': 'monographie imprimée'}]","Bibliothèque nationale de France, département Littérature et art, 8-Z R ROLLAND-87","[{'@xml:lang': 'fre', '#text': 'domaine public'}, {'@xml:lang': 'eng', '#text': 'public domain'}]","['[Colas Breugnon (français)]', 'Avec mode texte']",bnf.fr,,,"Bibliothèque nationale de France, département Littérature et art, 8-Z R ROLLAND-87",monographie,88.79,text,Colas Breugnon (50e éd.) / Romain Rolland,1919,08/03/2020,false
oai:bnf.fr:gallica/ark:/12148/bpt6k1524773g,2019-07-04,"['gallica:theme:0:00', 'gallica:typedoc:monographies']",http://purl.org/dc/elements/1.1/,http://www.openarchives.org/OAI/2.0/oai_dc/,http://www.w3.org/2001/XMLSchema-instance,http://www.openarchives.org/OAI/2.0/oai_dc/ http://www.openarchives.org/OAI/2.0/oai_dc.xsd,https://gallica.bnf.fr/ark:/12148/bpt6k1524773g,Ci-git ; précédé de la Culture indienne / par Antonin Artaud,"Artaud, Antonin (1896-1948). Auteur du texte",(Paris),1947,"['Non paginé ; 16 cm', 'Nombre total de vues :  71']","['fre', 'français']",Notice du catalogue : http://catalogue.bnf.fr/ark:/12148/cb329070555,"[{'@xml:lang': 'eng', '#text': 'text'}, {'@xml:lang': 'fre', '#text': 'monographie imprimée'}, {'@xml:lang': 'eng', '#text': 'monographie imprimée'}]","Bibliothèque nationale de France, département Réserve des livres rares, RES P-YE-2323","[{'@xml:lang': 'fre', '#text': 'domaine public'}, {'@xml:lang': 'eng', '#text': 'public domain'}]",,bnf.fr,00,0,"Bibliothèque nationale de France, département Réserve des livres rares, RES P-YE-2323",monographie,0.0,,Ci-git ; précédé de la Culture indienne / par Antonin Artaud,1947,08/07/2019,false
oai:bnf.fr:gallica/ark:/12148/bpt6k29325q,2019-07-20,"['gallica:theme:9:944', 'gallica:typedoc:monographies']",http://purl.org/dc/elements/1.1/,http://www.openarchives.org/OAI/2.0/oai_dc/,http://www.w3.org/2001/XMLSchema-instance,http://www.openarchives.org/OAI/2.0/oai_dc/ http://www.openarchives.org/OAI/2.0/oai_dc.xsd,https://gallica.bnf.fr/ark:/12148/bpt6k29325q,"Les diverses familles spirituelles de la France (Edition définitive avec des textes inédits) / Maurice Barrès,...","Barrès, Maurice (1862-1923). Auteur du texte",(Paris),1930,"['1 vol. (VI-278 p.) ; in-16', 'Nombre total de vues :  292']","['fre', 'français']",Notice du catalogue : http://catalogue.bnf.fr/ark:/12148/cb31766148p,"[{'@xml:lang': 'eng', '#text': 'text'}, {'@xml:lang': 'fre', '#text': 'monographie imprimée'}, {'@xml:lang': 'eng', '#text': 'monographie imprimée'}]",Bibliothèque nationale de France,"[{'@xml:lang': 'fre', '#text': 'domaine public'}, {'@xml:lang': 'eng', '#text': 'public domain'}]",Contient une table des matières,bnf.fr,944,9,Bibliothèque nationale de France,monographie,98.57,text,"Les diverses familles spirituelles de la France (Edition définitive avec des textes inédits) / Maurice Barrès,...",1930,15/10/2007,false
oai:bnf.fr:gallica/ark:/12148/bpt6k33249629,2020-02-14,"['gallica:corpus:PrnS001', 'gallica:theme:8:84', 'gallica:typedoc:monographies']",http://purl.org/dc/elements/1.1/,http://www.openarchives.org/OAI/2.0/oai_dc/,http://www.w3.org/2001/XMLSchema-instance,http://www.openarchives.org/OAI/2.0/oai_dc/ http://www.openarchives.org/OAI/2.0/oai_dc.xsd,"['https://gallica.bnf.fr/ark:/12148/bpt6k33249629', 'https://gallica.bnf.frISBN 2904638814']",Paul-Jean Toulet / Pierre-Olivier Walzer,"['Walzer, Pierre-Olivier (1915-2000). Auteur du texte', 'Toulet, Paul-Jean (1867-1920). Auteur du texte']",(Lyon),1987,"['1 vol. (209 p.) : ill. , couv. ill. ; 18 cm', 'Nombre total de vues :  266']","['fre', 'français']",Notice du catalogue : http://catalogue.bnf.fr/ark:/12148/cb34944299q,"[{'@xml:lang': 'eng', '#text': 'text'}, {'@xml:lang': 'fre', '#text': 'monographie imprimée'}, {'@xml:lang': 'eng', '#text': 'monographie imprimée'}]","Bibliothèque nationale de France, département Littérature et art, 16-Z-28117 (18)","[{'@xml:lang': 'fre', '#text': ""conditions spécifiques d'utilisation - Projet de numérisation des indisponibles""}, {'@xml:lang': 'eng', '#text': 'restricted use'}]","['Collection : Qui êtes-vous ? ; 18', 'Collection : Qui êtes-vous ? ; 18', 'Comprend : [Textes choisis] / Paul-Jean Toulet', 'Appartient à l’ensemble documentaire : PrnS001', 'Contient une table des matières', 'Avec mode texte']",bnf.fr,84,8,"Bibliothèque nationale de France, département Littérature et art, 16-Z-28117 (18)",monographie,99.99,text,Paul-Jean Toulet / Pierre-Olivier Walzer,1987,05/06/2016,false
oai:bnf.fr:gallica/ark:/12148/bpt6k34103441,2018-04-26,"['gallica:theme:8:84', 'gallica:typedoc:monographies']",http://purl.org/dc/elements/1.1/,http://www.openarchives.org/OAI/2.0/oai_dc/,http://www.w3.org/2001/XMLSchema-instance,http://www.openarchives.org/OAI/2.0/oai_dc/ http://www.openarchives.org/OAI/2.0/oai_dc.xsd,https://gallica.bnf.fr/ark:/12148/bpt6k34103441,"Simon le Pathétique / Jean Giraudoux ; portrait gravé sur bois, par Robert Bonfils","Giraudoux, Jean (1882-1944). Auteur du texte",G. Crès (Paris),1923,"['1 vol. (273 p.) ; in-8', 'Nombre total de vues :  314']","['fre', 'français']",Notice du catalogue : http://catalogue.bnf.fr/ark:/12148/cb32170001m,"[{'@xml:lang': 'eng', '#text': 'text'}, {'@xml:lang': 'fre', '#text': 'monographie imprimée'}, {'@xml:lang': 'eng', '#text': 'monographie imprimée'}]","Bibliothèque nationale de France, département Littérature et art, 8-Y2-67635","[{'@xml:lang': 'fre', '#text': 'domaine public'}, {'@xml:lang': 'eng', '#text': 'public domain'}]",Collection : Maîtres et jeunes d'aujourd'hui,bnf.fr,84,8,"Bibliothèque nationale de France, département Littérature et art, 8-Y2-67635",monographie,0.0,,"Simon le Pathétique / Jean Giraudoux ; portrait gravé sur bois, par Robert Bonfils",1923,02/06/2018,false
oai:bnf.fr:gallica/ark:/12148/bpt6k4220077c,2020-01-31,"['gallica:theme:8:84', 'gallica:typedoc:monographies']",http://purl.org/dc/elements/1.1/,http://www.openarchives.org/OAI/2.0/oai_dc/,http://www.w3.org/2001/XMLSchema-instance,http://www.openarchives.org/OAI/2.0/oai_dc/ http://www.openarchives.org/OAI/2.0/oai_dc.xsd,https://gallica.bnf.fr/ark:/12148/bpt6k4220077c,Charmes (Nouvelle édition revue) / Paul Valéry,"Valéry, Paul (1871-1945). Auteur du texte",(Paris),1926,"['1 vol. (125 p.) : fig. au titre et à la couv., couv. impr. en n. et r. ; in-16', 'Nombre total de vues :  150']","['fre', 'français']","['Notice d’oeuvre : http://catalogue.bnf.fr/ark:/12148/cb12200218d', 'Notice du catalogue : http://catalogue.bnf.fr/ark:/12148/cb31520967j']","[{'@xml:lang': 'eng', '#text': 'text'}, {'@xml:lang': 'fre', '#text': 'monographie imprimée'}, {'@xml:lang': 'eng', '#text': 'monographie imprimée'}]","Bibliothèque nationale de France, département Littérature et art, 8-YE-11857","[{'@xml:lang': 'fre', '#text': 'domaine public'}, {'@xml:lang': 'eng', '#text': 'public domain'}]","['[Charmes (français)]', 'Avec mode texte']",bnf.fr,84,8,"Bibliothèque nationale de France, département Littérature et art, 8-YE-11857",monographie,88.91,text,Charmes (Nouvelle édition revue) / Paul Valéry,1926,17/10/2019,false
oai:bnf.fr:gallica/ark:/12148/bpt6k939071t,2019-09-06,"['gallica:theme:8:84', 'gallica:typedoc:monographies']",http://purl.org/dc/elements/1.1/,http://www.openarchives.org/OAI/2.0/oai_dc/,http://www.w3.org/2001/XMLSchema-instance,http://www.openarchives.org/OAI/2.0/oai_dc/ http://www.openarchives.org/OAI/2.0/oai_dc.xsd,https://gallica.bnf.fr/ark:/12148/bpt6k939071t,Variété III / Paul Valéry...,"Valéry, Paul (1871-1945). Auteur du texte",(Paris),1936,"['1 vol. (311 p.) ; in-16', 'Nombre total de vues :  330']","['fre', 'français']",Notice du catalogue : http://catalogue.bnf.fr/ark:/12148/cb31521095j,"[{'@xml:lang': 'eng', '#text': 'text'}, {'@xml:lang': 'fre', '#text': 'monographie imprimée'}, {'@xml:lang': 'eng', '#text': 'monographie imprimée'}]","Bibliothèque nationale de France, département Littérature et art, 8-Z-27287 (3)","[{'@xml:lang': 'fre', '#text': 'domaine public'}, {'@xml:lang': 'eng', '#text': 'public domain'}]",Avec mode texte,bnf.fr,84,8,"Bibliothèque nationale de France, département Littérature et art, 8-Z-27287 (3)",monographie,89.54,text,Variété III / Paul Valéry...,1936,11/01/2016,false
oai:bnf.fr:gallica/ark:/12148/bpt6k9620247x,2018-04-26,"['gallica:theme:8:80', 'gallica:typedoc:monographies']",http://purl.org/dc/elements/1.1/,http://www.openarchives.org/OAI/2.0/oai_dc/,http://www.w3.org/2001/XMLSchema-instance,http://www.openarchives.org/OAI/2.0/oai_dc/ http://www.openarchives.org/OAI/2.0/oai_dc.xsd,https://gallica.bnf.fr/ark:/12148/bpt6k9620247x,"Portraits et souvenirs... ; Pour les mois d'hiver (2e éd.) / Henri de Régnier,...","Régnier, Henri de (1864-1936). Auteur du texte",Mercure de France (Paris),1913,"['1 vol. (334 p.) ; in-16', 'Nombre total de vues :  364']","['fre', 'français']",Notice du catalogue : http://catalogue.bnf.fr/ark:/12148/cb31189220p,"[{'@xml:lang': 'eng', '#text': 'text'}, {'@xml:lang': 'fre', '#text': 'monographie imprimée'}, {'@xml:lang': 'eng', '#text': 'monographie imprimée'}]","Bibliothèque nationale de France, département Littérature et art, 8-Z-6882","[{'@xml:lang': 'fre', '#text': 'domaine public'}, {'@xml:lang': 'eng', '#text': 'public domain'}]","['Contient une table des matières', 'Avec mode texte']",bnf.fr,80,8,"Bibliothèque nationale de France, département Littérature et art, 8-Z-6882",monographie,99.48,text,"Portraits et souvenirs... ; Pour les mois d'hiver (2e éd.) / Henri de Régnier,...",1913,22/02/2016,false
oai:bnf.fr:gallica/ark:/12148/btv1b10073919q,2022-10-19,gallica:typedoc:manuscrits,http://purl.org/dc/elements/1.1/,http://www.openarchives.org/OAI/2.0/oai_dc/,http://www.w3.org/2001/XMLSchema-instance,http://www.openarchives.org/OAI/2.0/oai_dc/ http://www.openarchives.org/OAI/2.0/oai_dc.xsd,https://gallica.bnf.fr/ark:/12148/btv1b10073919q,"Lettres et documents, XIXe-XXe siècles.","['Andrieu, Jules. Auteur de lettres', 'Camus, Albert. Auteur de lettres', 'Armando, Vincenzo. Auteur de lettres', 'Aude, Édouard. Auteur de lettres', 'Baudouin, Adolphe. Auteur de lettres', 'Baudrier, Henri. Auteur de lettres', 'Cartier, Alfred. Auteur de lettres', 'Delisle, Léopold. Auteur de lettres', 'Herriot, Édouard. Auteur de lettres', 'Macary, Sylvain. Auteur de lettres', 'Cocteau, Jean. Auteur du texte', 'Héron de Villefosse, René. Auteur de lettres', 'Silvestre, Charles. Auteur de lettres', 'Dolent, Jean. Auteur de lettres', 'Guilbert, Yvette. Auteur du texte', 'Sée, Edmond. Auteur du texte', 'Le Dantec, Yves-Gérard. Auteur du texte', 'Lefebvre, Jules. Auteur de lettres', 'Maillol, Aristide. Auteur de lettres', 'Noël, Marie Rouget dite Marie. Auteur de lettres', 'Carré, Le P. Ambroise-Marie. Auteur de lettres', 'Galanis, Démétrius-Emmanuel. Auteur de lettres', 'Mauch, F. A. Auteur de lettres', 'Rachel, Élisa Félix. Auteur de lettres', 'Doucet, Jacques. Auteur de lettres', 'Segalen, Victor. Auteur de lettres', 'Rolland, Romain. Auteur de lettres', 'Lauth-Sand, Aurore. Auteur du texte', 'Valéry, Paul. Auteur de lettres']",,XIXe-XXe s.,Pap. - 118 f. - 345 × 265 mm. - Demi-rel. chagrin rouge,fre,Notice du catalogue : http://archivesetmanuscrits.bnf.fr/ark:/12148/cc3975x,"[{'@xml:lang': 'eng', '#text': 'manuscript'}, {'@xml:lang': 'fre', '#text': 'manuscrit'}]",Bibliothèque nationale de France. Département des Manuscrits. NAF 16584,"[{'@xml:lang': 'fre', '#text': 'domaine public'}, {'@xml:lang': 'eng', '#text': 'public domain'}]","['Autographes (XIXe-XXe s.). Document(s) les concernant', ""Contient : Andrieu, Jules, historien de l'Agenais. Lettre(s) ; Cain, Julien, membre de l'Institut, administrateur de la Bibliothèque nationale. Lettre(s) reçue(s) ; Germain, Louis, instituteur. Manuscrit(s) provenant de lui ; Camus, Albert, écrivain. Lettre(s) ; Germain, Louis, instituteur. Lettre(s) reçue(s) ; Armando, Vincenzo, historien. Lettre(s) ; Claudin, Anatole, libraire. Lettre(s) reçue(s) ; Ricci, Seymour de. Manuscrit(s) provenant de lui ; Aude, Édouard. Lettre(s) ; Baudouin, Adolphe. Lettre(s) ; Baudrier, Henri. Lettre(s) ; Cartier, Alfred. Lettre(s) ; Delisle, Léopold, membre de l'Institut. Lettre(s) ; Herriot, Édouard, de l'Académie française, homme politique. Lettre(s) ; Macary, Sylvain, historien. Lettre(s) ; Cocteau, Jean, de l'Académie française. Gerbe à Tagore ; Comité National Pour La Célébration de La Naissance de Tagore. manuscrit(s) provenant de lui ; Tagore, Rabindranath, écrivain. Document(s) le concernant ; Deflandre, Maurice. Lettre(s) reçue(s) ; Deflandre, Maurice. Manuscrit(s) provenant de lui ; Goyau, Georges, de l'Académie française. Lettre(s) ; Héron de Villefosse, René. Lettre(s) ; Rémy, Tristan, écrivain. Lettre(s) ; Silvestre, Charles, écrivain. Lettre(s) ; Dolent, Jean, pseud. de Charles-Antoine Fournier. Lettre(s) ; Gallos, J.. Manuscrit(s) provenant de lui ; Montrosier, Eugène, historien d'art. Lettre(s) reçue(s) ; Guilbert, Yvette, chanteuse. Note(s) ; Schiller, Max. Manuscrit(s) provenant de lui ; Duhamel, Georges, pseud. Denis Thévenin, de l'Académie française. Lettre(s) ; Guilbert, Yvette, chanteuse. Lettre(s) reçue(s) ; Guilbert, Yvette, chanteuse. Document(s) la concernant ; Sée, Edmond, écrivain. Discours ; Adolphe, Lydie. Manuscrit(s) provenant d'elle ; Le Dantec, Yves-Gérard, écrivain. Article(s) ; Dallet-Brinkwood. Manuscrit(s) provenant de lui ; Lefebvre, Jules. Lettre(s) ; Maillol, Aristide, sculpteur. Lettre(s) ; Maillol, Aristide, sculpteur. Document(s) le concernant ; Bulot. Lettre(s) reçue(s) ; Lévy, Jacques. Manuscrit(s) provenant de lui ; Margueritte, Paul, écrivain. Lettre(s) ; Margueritte, Victor, écrivain. Lettre(s) ; Mackay, Helen. Lettre(s) reçue(s) ; Noël, Marie Rouget dite Marie, poète. Carte(s) ; Noël, Marie Rouget dite Marie, poète. Document(s) la concernant ; Carré, Le P. Ambroise-Marie, O.P., de l'Académie française. Lettre(s) ; Galanis, Démétrius-Emmanuel, peintre-graveur, membre de l'Institut. Lettre(s) ; Mauch, F. A.. Lettre(s) ; Flint, Mlle K.. Manuscrit(s) provenant d'elle ; Rachel, Élisa Félix, dite, actrice. Lettre(s) ; Doucet, Jacques. Lettre(s) ; René-Jean, René Jean, dit, bibliothécaire. Lettre(s) reçue(s) ; René-Jean, René Jean, dit, bibliothécaire. Manuscrit(s) provenant de lui ; Segalen, Victor, écrivain. Lettre(s) ; Doucet, Jacques. Lettre(s) reçue(s) ; Carton, Emma. Lettre(s) reçue(s) ; Rictus, Jehan, pseud de Gabriel Randon, écrivain. Lettre(s) ; Carton, Colette. Manuscrit(s) provenant d'elle ; Rictus, Jehan, pseud de Gabriel Randon, écrivain. Document(s) le concernant ; Rolland, Romain. Lettre(s) ; Lauth-Sand, Aurore. Article(s) sur George Sand ; Sand, Aurore Dupin, Baronne Dudevant, dite George. Document(s) la concernant ; Bennett, Arnold, écrivain. Lettre(s) reçue(s) ; Valéry, Paul, de l'Académie française. Lettre(s)"", ""Numérisation effectuée à partir d'un document de substitution : R 66523."", ""Aux f. 5-15, lettres d'Albert Camus ; au f. 43, Gerbe à Tagore de Jean Cocteau ; aux f. 106-110, lettres de Jehan Rictus."", 'Autographes (XIXe-XXe s.). Document(s) les concernant']",bnf.fr,,,Bibliothèque nationale de France. Département des Manuscrits. NAF 16584,manuscrit,0.0,,"Lettres et documents, XIXe-XXe siècles.",XIXe-XXe s.,22/11/2020,false
oai:bnf.fr:gallica/ark:/12148/bpt6k272191,2019-07-20,"['gallica:theme:8:84', 'gallica:typedoc:monographies']",http://purl.org/dc/elements/1.1/,http://www.openarchives.org/OAI/2.0/oai_dc/,http://www.w3.org/2001/XMLSchema-instance,http://www.openarchives.org/OAI/2.0/oai_dc/ http://www.openarchives.org/OAI/2.0/oai_dc.xsd,https://gallica.bnf.fr/ark:/12148/bpt6k272191,"Victor-Marie, comte Hugo / Charles Péguy","Péguy, Charles (1873-1914). Auteur du texte",(Paris),1969,"['1 vol. (241 p.) ; 19 cm', 'Nombre total de vues :  246']","['fre', 'français']","['Notice d’oeuvre : http://catalogue.bnf.fr/ark:/12148/cb145081165', 'Notice du catalogue : http://catalogue.bnf.fr/ark:/12148/cb372295924']","[{'@xml:lang': 'eng', '#text': 'text'}, {'@xml:lang': 'fre', '#text': 'monographie imprimée'}, {'@xml:lang': 'eng', '#text': 'monographie imprimée'}]",Bibliothèque nationale de France,"[{'@xml:lang': 'fre', '#text': 'domaine public'}, {'@xml:lang': 'eng', '#text': 'public domain'}]","[Victor-Marie, comte Hugo (français)]",bnf.fr,84,8,Bibliothèque nationale de France,monographie,0.0,,"Victor-Marie, comte Hugo / Charles Péguy",1969,30/01/2012,false
oai:bnf.fr:gallica/ark:/12148/bpt6k15241898,2019-05-03,"['gallica:theme:0:00', 'gallica:typedoc:monographies']",http://purl.org/dc/elements/1.1/,http://www.openarchives.org/OAI/2.0/oai_dc/,http://www.w3.org/2001/XMLSchema-instance,http://www.openarchives.org/OAI/2.0/oai_dc/ http://www.openarchives.org/OAI/2.0/oai_dc.xsd,https://gallica.bnf.fr/ark:/12148/bpt6k15241898,La France contre les robots / Georges Bernanos,"Bernanos, Georges (1888-1948). Auteur du texte",(Rio de Janeiro),1946,"['In-4° (27 cm), 118 p., portrait h. t. [Acq. 3385-62]', 'Nombre total de vues :  141']","['fre', 'français']",Notice du catalogue : http://catalogue.bnf.fr/ark:/12148/cb329197982,"[{'@xml:lang': 'eng', '#text': 'text'}, {'@xml:lang': 'fre', '#text': 'monographie imprimée'}, {'@xml:lang': 'eng', '#text': 'monographie imprimée'}]","Bibliothèque nationale de France, département Réserve des livres rares, RES M-R-161","[{'@xml:lang': 'fre', '#text': 'domaine public'}, {'@xml:lang': 'eng', '#text': 'public domain'}]",,bnf.fr,00,0,"Bibliothèque nationale de France, département Réserve des livres rares, RES M-R-161",monographie,0.0,,La France contre les robots / Georges Bernanos,1946,12/05/2019,false
oai:bnf.fr:gallica/ark:/12148/btv1b10582776f,2020-04-23,"['gallica:corpus:PrnS001', 'gallica:typedoc:manuscrits']",http://purl.org/dc/elements/1.1/,http://www.openarchives.org/OAI/2.0/oai_dc/,http://www.w3.org/2001/XMLSchema-instance,http://www.openarchives.org/OAI/2.0/oai_dc/ http://www.openarchives.org/OAI/2.0/oai_dc.xsd,https://gallica.bnf.fr/ark:/12148/btv1b10582776f,"Carte postale de Paul-Jean Toulet à un destinataire inconnu / Toulet, Paul-Jean (1867-1920)",,,1911,"['1 Carte postale', 'Nombre total de vues :  2']",Sans contenu linguistique,Notice du catalogue : http://catalogue.bnf.fr/ark:/12148/cb44943404m,"[{'@xml:lang': 'eng', '#text': 'manuscript'}, {'@xml:lang': 'fre', '#text': 'manuscrit'}]","Archives et bibliothèques Pau Béarn Pyrénées, MS223-10","[{'@xml:lang': 'fre', '#text': 'domaine public'}, {'@xml:lang': 'eng', '#text': 'public domain'}]",Appartient à l’ensemble documentaire : PrnS001,bnf.fr,,,"Archives et bibliothèques Pau Béarn Pyrénées, MS223-10",manuscrit,0.0,,"Carte postale de Paul-Jean Toulet à un destinataire inconnu / Toulet, Paul-Jean (1867-1920)",1911,16/02/2020,false
oai:bnf.fr:gallica/ark:/12148/btv1b10582630q,2020-04-23,"['gallica:corpus:PrnS001', 'gallica:typedoc:manuscrits']",http://purl.org/dc/elements/1.1/,http://www.openarchives.org/OAI/2.0/oai_dc/,http://www.w3.org/2001/XMLSchema-instance,http://www.openarchives.org/OAI/2.0/oai_dc/ http://www.openarchives.org/OAI/2.0/oai_dc.xsd,https://gallica.bnf.fr/ark:/12148/btv1b10582630q,"Carte postale de Paul-Jean Toulet à son filleul Pierre-Henri de la Blanchetai / Toulet, Paul-Jean (1867-1920)",,,1911,"['1 enveloppe + 1 Carte postale', 'Nombre total de vues :  4']",Sans contenu linguistique,Notice du catalogue : http://catalogue.bnf.fr/ark:/12148/cb449433499,"[{'@xml:lang': 'eng', '#text': 'manuscript'}, {'@xml:lang': 'fre', '#text': 'manuscrit'}]","Archives et bibliothèques Pau Béarn Pyrénées, Ms214-32","[{'@xml:lang': 'fre', '#text': 'domaine public'}, {'@xml:lang': 'eng', '#text': 'public domain'}]",Appartient à l’ensemble documentaire : PrnS001,bnf.fr,,,"Archives et bibliothèques Pau Béarn Pyrénées, Ms214-32",manuscrit,0.0,,"Carte postale de Paul-Jean Toulet à son filleul Pierre-Henri de la Blanchetai / Toulet, Paul-Jean (1867-1920)",1911,16/02/2020,false
oai:bnf.fr:gallica/ark:/12148/bpt6k991781k,2021-05-25,gallica:typedoc:monographies,http://purl.org/dc/elements/1.1/,http://www.openarchives.org/OAI/2.0/oai_dc/,http://www.w3.org/2001/XMLSchema-instance,http://www.openarchives.org/OAI/2.0/oai_dc/ http://www.openarchives.org/OAI/2.0/oai_dc.xsd,https://gallica.bnf.fr/ark:/12148/bpt6k991781k,"1914-1916. La Bataille sous Nancy / Maurice Barrès,... ; frontispice de Adolphe Giraldon","Barrès, Maurice (1862-1923). Auteur du texte",Maison du livre (Paris),1916,"['9 p. : planche, couv. ill. ; in-fol.', 'Nombre total de vues :  18']",fre,Notice du catalogue : http://catalogue.bnf.fr/ark:/12148/cb36562878x,"[{'@xml:lang': 'eng', '#text': 'text'}, {'@xml:lang': 'fre', '#text': 'monographie imprimée'}, {'@xml:lang': 'eng', '#text': 'printed monograph'}]","Bibliothèque nationale de France, département Littérature et art, Z BARRES-211","[{'@xml:lang': 'fre', '#text': 'domaine public'}, {'@xml:lang': 'eng', '#text': 'public domain'}]",Avec mode texte,bnf.fr,,,"Bibliothèque nationale de France, département Littérature et art, Z BARRES-211",monographie,87.13,text,"1914-1916. La Bataille sous Nancy / Maurice Barrès,... ; frontispice de Adolphe Giraldon",1916,14/12/2016,false
