identifier,datestamp,setSpec,@xmlns:dc,@xmlns:oai_dc,@xmlns:xsi,@xsi:schemaLocation,dc:identifier,dc:title,dc:creator,dc:publisher,dc:date,dc:format,dc:language,dc:relation,dc:type,dc:source,dc:rights,dc:description,provenance,sdewey,dewey,source,typedoc,nqamoyen,mode_indexation,title,date,first_indexation_date,streamable
oai:bnf.fr:gallica/ark:/12148/btv1b10582598d,2020-04-06,"['gallica:corpus:PrnS001', 'gallica:typedoc:manuscrits']",http://purl.org/dc/elements/1.1/,http://www.openarchives.org/OAI/2.0/oai_dc/,http://www.w3.org/2001/XMLSchema-instance,http://www.openarchives.org/OAI/2.0/oai_dc/ http://www.openarchives.org/OAI/2.0/oai_dc.xsd,https://gallica.bnf.fr/ark:/12148/btv1b10582598d,"Lettres, cartes postales, billets, notes, télégramme, envoyés de 1902 à 1919 / Toulet, Paul-Jean (1867-1920)",,,1902,Nombre total de vues :  154,Sans contenu linguistique,Notice du catalogue : http://catalogue.bnf.fr/ark:/12148/cb44942501m,"[{'@xml:lang': 'eng', '#text': 'manuscript'}, {'@xml:lang': 'fre', '#text': 'manuscrit'}]","Archives et bibliothèques Pau Béarn Pyrénées, Ms214","[{'@xml:lang': 'fre', '#text': 'domaine public'}, {'@xml:lang': 'eng', '#text': 'public domain'}]",Appartient à l’ensemble documentaire : PrnS001,bnf.fr,,,"Archives et bibliothèques Pau Béarn Pyrénées, Ms214",manuscrit,0.0,,"Lettres, cartes postales, billets, notes, télégramme, envoyés de 1902 à 1919 / Toulet, Paul-Jean (1867-1920)",1902,16/02/2020,false
oai:bnf.fr:gallica/ark:/12148/bpt6k200864f,2019-07-20,"['gallica:theme:9:944', 'gallica:typedoc:monographies']",http://purl.org/dc/elements/1.1/,http://www.openarchives.org/OAI/2.0/oai_dc/,http://www.w3.org/2001/XMLSchema-instance,http://www.openarchives.org/OAI/2.0/oai_dc/ http://www.openarchives.org/OAI/2.0/oai_dc.xsd,https://gallica.bnf.fr/ark:/12148/bpt6k200864f,"Dans le cloaque : notes d'un membre de la Commission d'enquête sur l'affaire Rochette / Maurice Barrès,...","Barrès, Maurice (1862-1923). Auteur du texte",(Paris),1914,"['1 vol. (120 p.) ; in-16', 'Nombre total de vues :  125']","['fre', 'français']",Notice du catalogue : http://catalogue.bnf.fr/ark:/12148/cb317660519,"[{'@xml:lang': 'eng', '#text': 'text'}, {'@xml:lang': 'fre', '#text': 'monographie imprimée'}, {'@xml:lang': 'eng', '#text': 'monographie imprimée'}]",Bibliothèque nationale de France,"[{'@xml:lang': 'fre', '#text': 'domaine public'}, {'@xml:lang': 'eng', '#text': 'public domain'}]",,bnf.fr,944,9,Bibliothèque nationale de France,monographie,95.0,text,"Dans le cloaque : notes d'un membre de la Commission d'enquête sur l'affaire Rochette / Maurice Barrès,...",1914,15/10/2007,false
oai:bnf.fr:gallica/ark:/12148/bpt6k1681004,2019-07-20,"['gallica:theme:9:944', 'gallica:typedoc:monographies']",http://purl.org/dc/elements/1.1/,http://www.openarchives.org/OAI/2.0/oai_dc/,http://www.w3.org/2001/XMLSchema-instance,http://www.openarchives.org/OAI/2.0/oai_dc/ http://www.openarchives.org/OAI/2.0/oai_dc.xsd,https://gallica.bnf.fr/ark:/12148/bpt6k1681004,Paris (notes d'un Vaudois) / C.-F. Ramuz,"Ramuz, Charles-Ferdinand (1878-1947). Auteur du texte",(Paris),1939,"['1 vol. (219 p.) : couv. ill. ; in-16', 'Nombre total de vues :  220']","['fre', 'français']",Notice du catalogue : http://catalogue.bnf.fr/ark:/12148/cb342173229,"[{'@xml:lang': 'eng', '#text': 'text'}, {'@xml:lang': 'fre', '#text': 'monographie imprimée'}, {'@xml:lang': 'eng', '#text': 'monographie imprimée'}]","Bibliothèque nationale de France, département Philosophie, histoire, sciences de l'homme, 8-LI3-1247","[{'@xml:lang': 'fre', '#text': 'domaine public'}, {'@xml:lang': 'eng', '#text': 'public domain'}]",,bnf.fr,944,9,"Bibliothèque nationale de France, département Philosophie, histoire, sciences de l'homme, 8-LI3-1247",monographie,0.0,,Paris (notes d'un Vaudois) / C.-F. Ramuz,1939,31/12/2017,false
oai:bnf.fr:gallica/ark:/12148/bpt6k689803,2019-07-19,"['gallica:theme:8:84', 'gallica:typedoc:monographies']",http://purl.org/dc/elements/1.1/,http://www.openarchives.org/OAI/2.0/oai_dc/,http://www.w3.org/2001/XMLSchema-instance,http://www.openarchives.org/OAI/2.0/oai_dc/ http://www.openarchives.org/OAI/2.0/oai_dc.xsd,https://gallica.bnf.fr/ark:/12148/bpt6k689803,Un homme libre / par Maurice Barrès,"Barrès, Maurice (1862-1923). Auteur du texte",(Paris),1889,"['297 p. ; in-16', 'Nombre total de vues :  302']","['fre', 'français']",Notice du catalogue : http://catalogue.bnf.fr/ark:/12148/cb30059791n,"[{'@xml:lang': 'eng', '#text': 'text'}, {'@xml:lang': 'fre', '#text': 'monographie imprimée'}, {'@xml:lang': 'eng', '#text': 'monographie imprimée'}]","Bibliothèque nationale de France, département Littérature et art, 8-Y2-43180","[{'@xml:lang': 'fre', '#text': 'domaine public'}, {'@xml:lang': 'eng', '#text': 'public domain'}]","['Appartient à l’ensemble documentaire : GTextes1', 'Contient une table des matières']",bnf.fr,84,8,"Bibliothèque nationale de France, département Littérature et art, 8-Y2-43180",monographie,92.28,text,Un homme libre / par Maurice Barrès,1889,15/10/2007,false
oai:bnf.fr:gallica/ark:/12148/btv1b10585357k,2020-10-22,"['gallica:corpus:PrnS001', 'gallica:typedoc:manuscrits']",http://purl.org/dc/elements/1.1/,http://www.openarchives.org/OAI/2.0/oai_dc/,http://www.w3.org/2001/XMLSchema-instance,http://www.openarchives.org/OAI/2.0/oai_dc/ http://www.openarchives.org/OAI/2.0/oai_dc.xsd,https://gallica.bnf.fr/ark:/12148/btv1b10585357k,"Carte postale de Paul-Jean Toulet à Claude Debussy / Toulet, Paul-Jean (1867-1920)",,,1912,"['1 carte postale', 'Nombre total de vues :  2']",Sans contenu linguistique,Notice du catalogue : http://catalogue.bnf.fr/ark:/12148/cb44943398h,"[{'@xml:lang': 'eng', '#text': 'manuscript'}, {'@xml:lang': 'fre', '#text': 'manuscrit'}]","Archives et bibliothèques Pau Béarn Pyrénées, Ms215","[{'@xml:lang': 'fre', '#text': 'domaine public'}, {'@xml:lang': 'eng', '#text': 'public domain'}]",Appartient à l’ensemble documentaire : PrnS001,bnf.fr,,,"Archives et bibliothèques Pau Béarn Pyrénées, Ms215",manuscrit,0.0,,"Carte postale de Paul-Jean Toulet à Claude Debussy / Toulet, Paul-Jean (1867-1920)",1912,09/06/2020,false
oai:bnf.fr:gallica/ark:/12148/bpt6k9618027p,2018-04-26,"['gallica:theme:8:80', 'gallica:typedoc:monographies']",http://purl.org/dc/elements/1.1/,http://www.openarchives.org/OAI/2.0/oai_dc/,http://www.w3.org/2001/XMLSchema-instance,http://www.openarchives.org/OAI/2.0/oai_dc/ http://www.openarchives.org/OAI/2.0/oai_dc.xsd,https://gallica.bnf.fr/ark:/12148/bpt6k9618027p,"Les scrupules de Miss Simpson / Henri de Régnier,...","Régnier, Henri de (1864-1936). Auteur du texte",A. Michel (Paris),1921,"['32 p. : couv. ill. en coul. ; in-16', 'Nombre total de vues :  34']","['fre', 'français']",Notice du catalogue : http://catalogue.bnf.fr/ark:/12148/cb311892393,"[{'@xml:lang': 'eng', '#text': 'text'}, {'@xml:lang': 'fre', '#text': 'monographie imprimée'}, {'@xml:lang': 'eng', '#text': 'monographie imprimée'}]","Bibliothèque nationale de France, département Littérature et art, 8-Y2-24992 (13)","[{'@xml:lang': 'fre', '#text': 'domaine public'}, {'@xml:lang': 'eng', '#text': 'public domain'}]","['Collection : Contemporaine Collection ; n° 13', 'Avec mode texte']",bnf.fr,80,8,"Bibliothèque nationale de France, département Littérature et art, 8-Y2-24992 (13)",monographie,98.5,text,"Les scrupules de Miss Simpson / Henri de Régnier,...",1921,21/12/2015,false
oai:bnf.fr:gallica/ark:/12148/bpt6k1139650,2022-12-23,"['gallica:theme:8:84', 'gallica:typedoc:monographies']",http://purl.org/dc/elements/1.1/,http://www.openarchives.org/OAI/2.0/oai_dc/,http://www.w3.org/2001/XMLSchema-instance,http://www.openarchives.org/OAI/2.0/oai_dc/ http://www.openarchives.org/OAI/2.0/oai_dc.xsd,https://gallica.bnf.fr/ark:/12148/bpt6k1139650,Le Surmâle : roman moderne / Alfred Jarry,"Jarry, Alfred (1873-1907). Auteur du texte",éditions de la Revue blanche (Paris),1902,"['1 vol. (248 p.) ; 20 cm', 'Nombre total de vues :  254']",fre,"['Notice d’oeuvre : http://catalogue.bnf.fr/ark:/12148/cb15502441w', 'Notice du catalogue : http://catalogue.bnf.fr/ark:/12148/cb30647261p']","[{'@xml:lang': 'eng', '#text': 'text'}, {'@xml:lang': 'fre', '#text': 'monographie imprimée'}, {'@xml:lang': 'eng', '#text': 'printed monograph'}]","Bibliothèque nationale de France, département Littérature et art, 8-Y2-53425","[{'@xml:lang': 'fre', '#text': 'domaine public'}, {'@xml:lang': 'eng', '#text': 'public domain'}]","['[Le surmâle (français)]', 'Appartient à l’ensemble documentaire : GTextes1']",bnf.fr,84,8,"Bibliothèque nationale de France, département Littérature et art, 8-Y2-53425",monographie,96.45,text,Le Surmâle : roman moderne / Alfred Jarry,1902,15/10/2007,false
oai:bnf.fr:gallica/ark:/12148/bpt6k9775732c,2018-11-09,"['gallica:theme:8:80', 'gallica:typedoc:monographies']",http://purl.org/dc/elements/1.1/,http://www.openarchives.org/OAI/2.0/oai_dc/,http://www.w3.org/2001/XMLSchema-instance,http://www.openarchives.org/OAI/2.0/oai_dc/ http://www.openarchives.org/OAI/2.0/oai_dc.xsd,https://gallica.bnf.fr/ark:/12148/bpt6k9775732c,Calligrammes / Guillaume Apollinaire ; dessins de La Fresnaye,"Apollinaire, Guillaume (1880-1918). Auteur du texte",(Lausanne),1952,"['1 vol. (210 p.) : pl., couv. ill. ; in-16', 'Nombre total de vues :  262']","['fre', 'français']","['Notice d’oeuvre : http://catalogue.bnf.fr/ark:/12148/cb119430681', 'Notice du catalogue : http://catalogue.bnf.fr/ark:/12148/cb317256407']","[{'@xml:lang': 'eng', '#text': 'text'}, {'@xml:lang': 'fre', '#text': 'monographie imprimée'}, {'@xml:lang': 'eng', '#text': 'monographie imprimée'}]","Bibliothèque nationale de France, département Littérature et art, 16-Z-789 (52)","[{'@xml:lang': 'fre', '#text': 'domaine public'}, {'@xml:lang': 'eng', '#text': 'public domain'}]","['[Calligrammes (français)]', 'Collection : Collection du Bouquet ; 52', 'Collection : Collection du Bouquet ; 52', 'Contient une table des matières', 'Avec mode texte']",bnf.fr,80,8,"Bibliothèque nationale de France, département Littérature et art, 16-Z-789 (52)",monographie,99.83,text,Calligrammes / Guillaume Apollinaire ; dessins de La Fresnaye,1952,01/05/2017,false
oai:bnf.fr:gallica/ark:/12148/btv1b10582635z,2020-04-23,"['gallica:corpus:PrnS001', 'gallica:typedoc:manuscrits']",http://purl.org/dc/elements/1.1/,http://www.openarchives.org/OAI/2.0/oai_dc/,http://www.w3.org/2001/XMLSchema-instance,http://www.openarchives.org/OAI/2.0/oai_dc/ http://www.openarchives.org/OAI/2.0/oai_dc.xsd,https://gallica.bnf.fr/ark:/12148/btv1b10582635z,"Carte postale de Paul-Jean Toulet à son filleul Pierre-Henri de la Blanchetai / Toulet, Paul-Jean (1867-1920)",,,1902,"['1 carte postale', 'Nombre total de vues :  2']",Sans contenu linguistique,Notice du catalogue : http://catalogue.bnf.fr/ark:/12148/cb44943354w,"[{'@xml:lang': 'eng', '#text': 'manuscript'}, {'@xml:lang': 'fre', '#text': 'manuscrit'}]","Archives et bibliothèques Pau Béarn Pyrénées, Ms214-37","[{'@xml:lang': 'fre', '#text': 'domaine public'}, {'@xml:lang': 'eng', '#text': 'public domain'}]",Appartient à l’ensemble documentaire : PrnS001,bnf.fr,,,"Archives et bibliothèques Pau Béarn Pyrénées, Ms214-37",manuscrit,0.0,,"Carte postale de Paul-Jean Toulet à son filleul Pierre-Henri de la Blanchetai / Toulet, Paul-Jean (1867-1920)",1902,16/02/2020,false
oai:bnf.fr:gallica/ark:/12148/bpt6k15254174,2022-10-19,"['gallica:theme:0:00', 'gallica:typedoc:monographies']",http://purl.org/dc/elements/1.1/,http://www.openarchives.org/OAI/2.0/oai_dc/,http://www.w3.org/2001/XMLSchema-instance,http://www.openarchives.org/OAI/2.0/oai_dc/ http://www.openarchives.org/OAI/2.0/oai_dc.xsd,https://gallica.bnf.fr/ark:/12148/bpt6k15254174,Les forces éternelles / Comtesse de Noailles,"Noailles, Anna de (1876-1933). Auteur du texte",A. Fayard et Cie (Paris),1920,"['421 p. ; 19 cm', 'Nombre total de vues :  458']",fre,Notice du catalogue : http://catalogue.bnf.fr/ark:/12148/cb324883493,"[{'@xml:lang': 'eng', '#text': 'text'}, {'@xml:lang': 'fre', '#text': 'monographie imprimée'}, {'@xml:lang': 'eng', '#text': 'printed monograph'}]","Bibliothèque nationale de France, département Réserve des livres rares, RES P-YE-1237","[{'@xml:lang': 'fre', '#text': 'domaine public'}, {'@xml:lang': 'eng', '#text': 'public domain'}]",,bnf.fr,00,0,"Bibliothèque nationale de France, département Réserve des livres rares, RES P-YE-1237",monographie,0.0,,Les forces éternelles / Comtesse de Noailles,1920,17/10/2019,false
oai:bnf.fr:gallica/ark:/12148/btv1b100764493,2021-06-18,"['gallica:theme:0:00', 'gallica:typedoc:monographies']",http://purl.org/dc/elements/1.1/,http://www.openarchives.org/OAI/2.0/oai_dc/,http://www.w3.org/2001/XMLSchema-instance,http://www.openarchives.org/OAI/2.0/oai_dc/ http://www.openarchives.org/OAI/2.0/oai_dc.xsd,https://gallica.bnf.fr/ark:/12148/btv1b100764493,Musiciens d'aujourd'hui (Dix-neuvième édition) / Romain Rolland,"Rolland, Romain (1866-1944). Auteur du texte",Hachette (Paris),1949,"['In-16, 282 p.', 'Nombre total de vues :  148']",fre,Notice du catalogue : http://catalogue.bnf.fr/ark:/12148/cb432395352,"[{'@xml:lang': 'eng', '#text': 'text'}, {'@xml:lang': 'fre', '#text': 'monographie imprimée'}, {'@xml:lang': 'eng', '#text': 'printed monograph'}]","Bibliothèque nationale de France, département Musique, 4-VM-103 (A)","[{'@xml:lang': 'fre', '#text': 'domaine public'}, {'@xml:lang': 'eng', '#text': 'public domain'}]","[""Collection : Bibliothèque d'histoire"", ""Collection : Bibliothèque d'histoire""]",bnf.fr,00,0,"Bibliothèque nationale de France, département Musique, 4-VM-103 (A)",monographie,0.0,,Musiciens d'aujourd'hui (Dix-neuvième édition) / Romain Rolland,1949,20/06/2021,false
oai:bnf.fr:gallica/ark:/12148/btv1b10582655s,2020-04-23,"['gallica:corpus:PrnS001', 'gallica:typedoc:manuscrits']",http://purl.org/dc/elements/1.1/,http://www.openarchives.org/OAI/2.0/oai_dc/,http://www.w3.org/2001/XMLSchema-instance,http://www.openarchives.org/OAI/2.0/oai_dc/ http://www.openarchives.org/OAI/2.0/oai_dc.xsd,https://gallica.bnf.fr/ark:/12148/btv1b10582655s,"Carte postale de Paul-Jean Toulet à son filleul Pierre-Henri de la Blanchetai / Toulet, Paul-Jean (1867-1920)",,,1911,"['1 carte postale', 'Nombre total de vues :  2']",Sans contenu linguistique,Notice du catalogue : http://catalogue.bnf.fr/ark:/12148/cb44943393s,"[{'@xml:lang': 'eng', '#text': 'manuscript'}, {'@xml:lang': 'fre', '#text': 'manuscrit'}]","Archives et bibliothèques Pau Béarn Pyrénées, Ms214-57","[{'@xml:lang': 'fre', '#text': 'domaine public'}, {'@xml:lang': 'eng', '#text': 'public domain'}]",Appartient à l’ensemble documentaire : PrnS001,bnf.fr,,,"Archives et bibliothèques Pau Béarn Pyrénées, Ms214-57",manuscrit,0.0,,"Carte postale de Paul-Jean Toulet à son filleul Pierre-Henri de la Blanchetai / Toulet, Paul-Jean (1867-1920)",1911,16/02/2020,false
oai:bnf.fr:gallica/ark:/12148/bpt6k5452813b,2019-07-20,"['gallica:corpus:Pam1', 'gallica:theme:8:84', 'gallica:typedoc:monographies']",http://purl.org/dc/elements/1.1/,http://www.openarchives.org/OAI/2.0/oai_dc/,http://www.w3.org/2001/XMLSchema-instance,http://www.openarchives.org/OAI/2.0/oai_dc/ http://www.openarchives.org/OAI/2.0/oai_dc.xsd,https://gallica.bnf.fr/ark:/12148/bpt6k5452813b,"Jocaste et le chat maigre / Anatole France,...","France, Anatole (1844-1924). Auteur du texte",(Paris),1925,"['1 vol. (295 p.) ; 19 cm', 'Nombre total de vues :  316']","['fre', 'français']",Notice du catalogue : http://catalogue.bnf.fr/ark:/12148/cb32123811t,"[{'@xml:lang': 'eng', '#text': 'text'}, {'@xml:lang': 'fre', '#text': 'monographie imprimée'}, {'@xml:lang': 'eng', '#text': 'monographie imprimée'}]","Bibliothèque nationale de France, département Littérature et art, 8-Y2-72622","[{'@xml:lang': 'fre', '#text': 'domaine public'}, {'@xml:lang': 'eng', '#text': 'public domain'}]","['Collection : Collection bleue', 'Collection : Collection bleue', 'Appartient à l’ensemble documentaire : Pam1', 'Contient une table des matières', 'Avec mode texte']",bnf.fr,84,8,"Bibliothèque nationale de France, département Littérature et art, 8-Y2-72622",monographie,96.09,text,"Jocaste et le chat maigre / Anatole France,...",1925,05/11/2008,false
oai:bnf.fr:gallica/ark:/12148/btv1b8618381s,2019-06-07,gallica:typedoc:monographies,http://purl.org/dc/elements/1.1/,http://www.openarchives.org/OAI/2.0/oai_dc/,http://www.w3.org/2001/XMLSchema-instance,http://www.openarchives.org/OAI/2.0/oai_dc/ http://www.openarchives.org/OAI/2.0/oai_dc.xsd,https://gallica.bnf.fr/ark:/12148/btv1b8618381s,Les Minutes de sable : mémorial / Alfred jarry,"Jarry, Alfred (1873-1907). Auteur du texte",(Paris),1894,"['1 vol. (IX-210-[3] p.-[9] f. de pl.) ; 15 cm', 'Nombre total de vues :  249']","['fre', 'français']","[""Notice d'ensemble : http://catalogue.bnf.fr/ark:/12148/cb35873187s"", 'Notice du catalogue : http://catalogue.bnf.fr/ark:/12148/cb35873187s']","[{'@xml:lang': 'eng', '#text': 'text'}, {'@xml:lang': 'fre', '#text': 'monographie imprimée'}, {'@xml:lang': 'eng', '#text': 'monographie imprimée'}]","Bibliothèque nationale de France, département Réserve des livres rares, RESP-Z-2580","[{'@xml:lang': 'fre', '#text': 'domaine public'}, {'@xml:lang': 'eng', '#text': 'public domain'}]","['Appartient à l’ensemble documentaire : GTextes1', 'Avec mode texte']",bnf.fr,,,"Bibliothèque nationale de France, département Réserve des livres rares, RESP-Z-2580",monographie,99.94,text,Les Minutes de sable : mémorial / Alfred jarry,1894,11/07/2011,false
oai:bnf.fr:gallica/ark:/12148/btv1b10582639r,2020-04-23,"['gallica:corpus:PrnS001', 'gallica:typedoc:manuscrits']",http://purl.org/dc/elements/1.1/,http://www.openarchives.org/OAI/2.0/oai_dc/,http://www.w3.org/2001/XMLSchema-instance,http://www.openarchives.org/OAI/2.0/oai_dc/ http://www.openarchives.org/OAI/2.0/oai_dc.xsd,https://gallica.bnf.fr/ark:/12148/btv1b10582639r,"Carte postale de Paul-Jean Toulet à son filleul Pierre-Henri de la Blanchetai / Toulet, Paul-Jean (1867-1920)",,,19..,"['1 carte postale', 'Nombre total de vues :  2']",Sans contenu linguistique,Notice du catalogue : http://catalogue.bnf.fr/ark:/12148/cb449433588,"[{'@xml:lang': 'eng', '#text': 'manuscript'}, {'@xml:lang': 'fre', '#text': 'manuscrit'}]","Archives et bibliothèques Pau Béarn Pyrénées, Ms214-41","[{'@xml:lang': 'fre', '#text': 'domaine public'}, {'@xml:lang': 'eng', '#text': 'public domain'}]",Appartient à l’ensemble documentaire : PrnS001,bnf.fr,,,"Archives et bibliothèques Pau Béarn Pyrénées, Ms214-41",manuscrit,0.0,,"Carte postale de Paul-Jean Toulet à son filleul Pierre-Henri de la Blanchetai / Toulet, Paul-Jean (1867-1920)",19..,16/02/2020,false
oai:bnf.fr:gallica/ark:/12148/btv1b86002393,2018-04-26,gallica:typedoc:monographies,http://purl.org/dc/elements/1.1/,http://www.openarchives.org/OAI/2.0/oai_dc/,http://www.w3.org/2001/XMLSchema-instance,http://www.openarchives.org/OAI/2.0/oai_dc/ http://www.openarchives.org/OAI/2.0/oai_dc.xsd,https://gallica.bnf.fr/ark:/12148/btv1b86002393,L' affaire Crainquebille : [épreuves corrigées] / [Anatole France],"France, Anatole (1844-1924). Auteur du texte",[E. Pelletan] (Paris),1901,"['77 f. ; 33 cm', 'Nombre total de vues :  157']","['fre', 'français']",Notice du catalogue : http://catalogue.bnf.fr/ark:/12148/cb362027704,"[{'@xml:lang': 'eng', '#text': 'text'}, {'@xml:lang': 'fre', '#text': 'monographie imprimée'}, {'@xml:lang': 'eng', '#text': 'monographie imprimée'}]","Bibliothèque nationale de France, département Réserve des livres rares, RESG-Y2-652","[{'@xml:lang': 'fre', '#text': 'domaine public'}, {'@xml:lang': 'eng', '#text': 'public domain'}]",,bnf.fr,,,"Bibliothèque nationale de France, département Réserve des livres rares, RESG-Y2-652",monographie,0.0,,L' affaire Crainquebille : [épreuves corrigées] / [Anatole France],1901,27/09/2010,false
oai:bnf.fr:gallica/ark:/12148/btv1b8600235f,2018-04-26,gallica:typedoc:monographies,http://purl.org/dc/elements/1.1/,http://www.openarchives.org/OAI/2.0/oai_dc/,http://www.w3.org/2001/XMLSchema-instance,http://www.openarchives.org/OAI/2.0/oai_dc/ http://www.openarchives.org/OAI/2.0/oai_dc.xsd,https://gallica.bnf.fr/ark:/12148/btv1b8600235f,"Le lys rouge / Anatole France,... ; compositions de A.-F. Gorguet, gravées sur bois par Desmoulins, Dutheil, Romagnol, et en couleurs par Ch. Thévenin","France, Anatole (1844-1924). Auteur du texte",A. Romagnol (Paris),1903,"['303 p. : portr. et fig. en noir, pl. gravées en couleurs, couv. illustrée ; gr. in-8', 'Nombre total de vues :  369', 'application/epub+zip']","['fre', 'français']",Notice du catalogue : http://catalogue.bnf.fr/ark:/12148/cb30457736q,"[{'@xml:lang': 'eng', '#text': 'text'}, {'@xml:lang': 'fre', '#text': 'monographie imprimée'}, {'@xml:lang': 'eng', '#text': 'monographie imprimée'}]","Bibliothèque nationale de France, département Réserve des livres rares, RES M-Y2-63","[{'@xml:lang': 'fre', '#text': 'domaine public'}, {'@xml:lang': 'eng', '#text': 'public domain'}]",,bnf.fr,,,"Bibliothèque nationale de France, département Réserve des livres rares, RES M-Y2-63",monographie,0.0,,"Le lys rouge / Anatole France,... ; compositions de A.-F. Gorguet, gravées sur bois par Desmoulins, Dutheil, Romagnol, et en couleurs par Ch. Thévenin",1903,31/05/2010,false
oai:bnf.fr:gallica/ark:/12148/bpt6k11975261,2021-12-16,gallica:typedoc:monographies,http://purl.org/dc/elements/1.1/,http://www.openarchives.org/OAI/2.0/oai_dc/,http://www.w3.org/2001/XMLSchema-instance,http://www.openarchives.org/OAI/2.0/oai_dc/ http://www.openarchives.org/OAI/2.0/oai_dc.xsd,https://gallica.bnf.fr/ark:/12148/bpt6k11975261,Kola Brûnʹon / Romèn Rollan,"Rolland, Romain (1866-1944). Auteur du texte",Gos. učebno-pedagogičeskoe izd-vo Ministerstva prosveŝeniâ RSFSR (Moskva),1950,"['98 p.', 'Nombre total de vues :  110']",fre,"['Notice d’oeuvre : http://catalogue.bnf.fr/ark:/12148/cb16265113d', 'Notice du catalogue : http://catalogue.bnf.fr/ark:/12148/cb35373544r']","[{'@xml:lang': 'eng', '#text': 'text'}, {'@xml:lang': 'fre', '#text': 'monographie imprimée'}, {'@xml:lang': 'eng', '#text': 'printed monograph'}]","Bibliothèque nationale de France, département Littérature et art, 8-Z R ROLLAND-1093","[{'@xml:lang': 'fre', '#text': 'domaine public'}, {'@xml:lang': 'eng', '#text': 'public domain'}]","['[Colas Breugnon (français)]', 'Titre original : Colas Breugnon. Adaptation']",bnf.fr,,,"Bibliothèque nationale de France, département Littérature et art, 8-Z R ROLLAND-1093",monographie,0.0,,Kola Brûnʹon / Romèn Rollan,1950,19/12/2021,false
oai:bnf.fr:gallica/ark:/12148/bpt6k10494681,2022-06-22,gallica:typedoc:monographies,http://purl.org/dc/elements/1.1/,http://www.openarchives.org/OAI/2.0/oai_dc/,http://www.w3.org/2001/XMLSchema-instance,http://www.openarchives.org/OAI/2.0/oai_dc/ http://www.openarchives.org/OAI/2.0/oai_dc.xsd,https://gallica.bnf.fr/ark:/12148/bpt6k10494681,"La poésie symboliste : trois entretiens sur les temps héroïques, période symboliste, au Salon des artistes indépendants, 1908","['Roinard, Paul-Napoléon (1856-1930). Auteur du texte', 'Michelet, Victor-Émile (1861-1938). Auteur du texte', 'Apollinaire, Guillaume (1880-1918). Auteur du texte']",L'Edition (Paris),1908,"['1 vol. (252 p.) ; 19 cm', 'Nombre total de vues :  261']",fre,Notice du catalogue : http://catalogue.bnf.fr/ark:/12148/cb359006875,"[{'@xml:lang': 'eng', '#text': 'text'}, {'@xml:lang': 'fre', '#text': 'monographie imprimée'}, {'@xml:lang': 'eng', '#text': 'printed monograph'}]","Bibliothèque nationale de France, département Réserve des livres rares, RES-Z LE MASLE-16","[{'@xml:lang': 'fre', '#text': 'domaine public'}, {'@xml:lang': 'eng', '#text': 'public domain'}]",Comprend : Nos maîtres et nos morts ; Les survivants ; La Phalange nouvelle,bnf.fr,,,"Bibliothèque nationale de France, département Réserve des livres rares, RES-Z LE MASLE-16",monographie,0.0,,"La poésie symboliste : trois entretiens sur les temps héroïques, période symboliste, au Salon des artistes indépendants, 1908",1908,11/11/2013,false
oai:bnf.fr:gallica/ark:/12148/bpt6k3410382q,2018-04-26,"['gallica:theme:8:84', 'gallica:typedoc:monographies']",http://purl.org/dc/elements/1.1/,http://www.openarchives.org/OAI/2.0/oai_dc/,http://www.w3.org/2001/XMLSchema-instance,http://www.openarchives.org/OAI/2.0/oai_dc/ http://www.openarchives.org/OAI/2.0/oai_dc.xsd,https://gallica.bnf.fr/ark:/12148/bpt6k3410382q,"Le mariage de minuit (Édition définitive) / Henri de Régnier,... ; avec 21 gravures originales sur bois de René Pottier","Régnier, Henri de (1864-1936). Auteur du texte",Hachette (Paris),1929,"['1 vol. (269 p.) : fig. ; in-8', 'Nombre total de vues :  296']","['fre', 'français']",Notice du catalogue : http://catalogue.bnf.fr/ark:/12148/cb31189187p,"[{'@xml:lang': 'eng', '#text': 'text'}, {'@xml:lang': 'fre', '#text': 'monographie imprimée'}, {'@xml:lang': 'eng', '#text': 'monographie imprimée'}]","Bibliothèque nationale de France, département Littérature et art, 8-Y2-74170","[{'@xml:lang': 'fre', '#text': 'domaine public'}, {'@xml:lang': 'eng', '#text': 'public domain'}]",Collection : Les grands écrivains,bnf.fr,84,8,"Bibliothèque nationale de France, département Littérature et art, 8-Y2-74170",monographie,0.0,,"Le mariage de minuit (Édition définitive) / Henri de Régnier,... ; avec 21 gravures originales sur bois de René Pottier",1929,21/05/2018,false
